{
  "schema_version": "2.0",
  "deck_id": "DECK-6F7DCB3E-7055-5CC9-B251-4A771398B4C7",
  "deck_version": 1,
  "narrative_mode": "scientific_problem",
  "brief_hash": "0720e144ccf9508140da0a8ac3c4a1ee6895c9ed033d15b7137da80f010ce472",
  "slides": [
    {
      "slide_id": "SLD-8EF87E789A485E3F8EB6",
      "slide_revision": 1,
      "slide_role": "cover",
      "narrative_mode": "scientific_problem",
      "key_message": "复杂合成医学科研材料的可追溯影子验证；不代表真实临床研究或真实世界验证。",
      "claim_ids": [],
      "source_ids": [
        "SRC-01-patient-level-synthet-44fed4fb8cd3",
        "SRC-02-cohort-summary-1dbb58326345",
        "SRC-03-model-results-60094a3fa178",
        "SRC-04-sensitivity-results-5ccfe8975248",
        "SRC-05-subgroup-results-2615cf06f550",
        "SRC-06-missingness-52d547971cf7",
        "SRC-07-data-dictionary-651b51eed07b",
        "SRC-08-frozen-analysis-workb-7c9d8fa9a6d0",
        "SRC-01-main-manuscript-synth-95e4fa25aff0",
        "SRC-02-protocol-synopsis-syn-00480991443d",
        "SRC-03-supplementary-methods-91c0cedcb895",
        "SRC-figure-1-cohort-flow-768a1278488a",
        "SRC-figure-2-primary-forest-64b705494c45",
        "SRC-figure-3-creatinine-traj-a6ac74f7bbf8",
        "SRC-figure-4-missingness-f10f6562518f",
        "SRC-figure-5-sensitivity-1ccb24ef4f17",
        "SRC-figure-5-sensitivity-7703f707fec0",
        "SRC-reference-status-ca4e36a12f8d",
        "SRC-selected-references-9ba20483f340"
      ],
      "layout_id": "minimal_cover",
      "backend": "pptxgenjs",
      "template_layout_id": null,
      "visual_assets": [],
      "editable_object_requirements": [],
      "speaker_notes": "State scope and that all reported content is source-bound.",
      "manual_review_required": true,
      "content_hash": "f41e91ab22f4e8c144a0f19393c05f6f78f11c468c7e64faea20df9e9f633816",
      "render_hash": "",
      "logical_slide_key": "cover",
      "section_id": "opening",
      "figure_ids": [],
      "managed_object_ids": [],
      "powerpoint_slide_id": null,
      "slide_title": "SYN_CARDIO_AKI_SHADOW_VALIDATION",
      "slide_purpose": "Introduce the project and presentation objective",
      "single_key_message": "复杂合成医学科研材料的可追溯影子验证；不代表真实临床研究或真实世界验证。",
      "proposed_layout": "minimal_cover",
      "visual_type": "typography",
      "citation_requirement": "none unless title uses source-specific facts",
      "speaker_note_summary": "State scope and that all reported content is source-bound.",
      "confidence": "high"
    },
    {
      "slide_id": "SLD-A9E00233DA0B5C5BBEB4",
      "slide_revision": 1,
      "slide_role": "evidence_boundary",
      "narrative_mode": "scientific_problem",
      "key_message": "已登记 19 个科研来源文件并保留 SHA-256 溯源。",
      "claim_ids": [],
      "source_ids": [
        "SRC-01-patient-level-synthet-44fed4fb8cd3",
        "SRC-02-cohort-summary-1dbb58326345",
        "SRC-03-model-results-60094a3fa178",
        "SRC-04-sensitivity-results-5ccfe8975248",
        "SRC-05-subgroup-results-2615cf06f550",
        "SRC-06-missingness-52d547971cf7",
        "SRC-07-data-dictionary-651b51eed07b",
        "SRC-08-frozen-analysis-workb-7c9d8fa9a6d0",
        "SRC-01-main-manuscript-synth-95e4fa25aff0",
        "SRC-02-protocol-synopsis-syn-00480991443d",
        "SRC-03-supplementary-methods-91c0cedcb895",
        "SRC-figure-1-cohort-flow-768a1278488a",
        "SRC-figure-2-primary-forest-64b705494c45",
        "SRC-figure-3-creatinine-traj-a6ac74f7bbf8",
        "SRC-figure-4-missingness-f10f6562518f",
        "SRC-figure-5-sensitivity-1ccb24ef4f17",
        "SRC-figure-5-sensitivity-7703f707fec0",
        "SRC-reference-status-ca4e36a12f8d",
        "SRC-selected-references-9ba20483f340"
      ],
      "layout_id": "text_plus_source_list",
      "backend": "pptxgenjs",
      "template_layout_id": null,
      "visual_assets": [],
      "editable_object_requirements": [],
      "speaker_notes": "Explain that unprovided information is not inferred.",
      "manual_review_required": false,
      "content_hash": "cc53f634b695baa22c5348944b70becdc8809595513c368944ebcf474918d0bd",
      "render_hash": "",
      "logical_slide_key": "evidence-boundary",
      "section_id": "opening",
      "figure_ids": [],
      "managed_object_ids": [],
      "powerpoint_slide_id": null,
      "slide_title": "输入材料界定本次汇报的证据边界",
      "slide_purpose": "在解释前声明证据边界",
      "single_key_message": "已登记 19 个科研来源文件并保留 SHA-256 溯源。",
      "proposed_layout": "text_plus_source_list",
      "visual_type": "source_map",
      "citation_requirement": "source manifest",
      "speaker_note_summary": "Explain that unprovided information is not inferred.",
      "confidence": "high",
      "source_records": [
        {
          "file_name": "01_patient_level_synthetic.csv",
          "file_type": "csv",
          "source_id": "SRC-01-patient-level-synthet-44fed4fb8cd3"
        },
        {
          "file_name": "02_cohort_summary.csv",
          "file_type": "csv",
          "source_id": "SRC-02-cohort-summary-1dbb58326345"
        },
        {
          "file_name": "03_model_results.csv",
          "file_type": "csv",
          "source_id": "SRC-03-model-results-60094a3fa178"
        },
        {
          "file_name": "04_sensitivity_results.csv",
          "file_type": "csv",
          "source_id": "SRC-04-sensitivity-results-5ccfe8975248"
        },
        {
          "file_name": "05_subgroup_results.csv",
          "file_type": "csv",
          "source_id": "SRC-05-subgroup-results-2615cf06f550"
        },
        {
          "file_name": "06_missingness.csv",
          "file_type": "csv",
          "source_id": "SRC-06-missingness-52d547971cf7"
        }
      ]
    },
    {
      "slide_id": "SLD-4ABCCA3C794D54E8A2D7",
      "slide_revision": 1,
      "slide_role": "result",
      "narrative_mode": "scientific_problem",
      "key_message": "该完全合成观察性队列用于评估入组后 24 小时心室功能表型与随后 72 小时 AKI 进展的关联，不代表真实临床证据。",
      "claim_ids": [
        "SHD-001"
      ],
      "source_ids": [
        "SRC-01-main-manuscript-synth-95e4fa25aff0"
      ],
      "layout_id": "result_statement",
      "backend": "pptxgenjs",
      "template_layout_id": null,
      "visual_assets": [],
      "editable_object_requirements": [],
      "speaker_notes": "Source: extracted line 5. Avoid: 仅可表述为合成观察性关联；不得表述为真实患者研究或因果效应。",
      "manual_review_required": true,
      "content_hash": "b8f1ec5563015c8b43a8f6ce37d72714c76bd37bb55a9d25c8f65711416ab20c",
      "render_hash": "",
      "logical_slide_key": "result:SRC-01-main-manuscript-synth-95e4fa25aff0:extracted line 5:SHD-001",
      "section_id": "results",
      "figure_ids": [],
      "managed_object_ids": [],
      "powerpoint_slide_id": null,
      "slide_title": "本次分析聚焦心室表型与随后 AKI 进展的关联",
      "slide_purpose": "Present one source-bound result",
      "single_key_message": "该完全合成观察性队列用于评估入组后 24 小时心室功能表型与随后 72 小时 AKI 进展的关联，不代表真实临床证据。",
      "proposed_layout": "result_statement",
      "visual_type": "editable_bar_chart",
      "citation_requirement": "required",
      "speaker_note_summary": "Source: extracted line 5. Avoid: 仅可表述为合成观察性关联；不得表述为真实患者研究或因果效应。",
      "confidence": "high",
      "chart_data": {
        "categories": [
          "No ventricular dysfunction",
          "Isolated LV dysfunction",
          "Isolated RV dysfunction",
          "Biventricular dysfunction"
        ],
        "source_id": "SRC-02-cohort-summary-1dbb58326345",
        "unit": "percent",
        "values": [
          25.7,
          35.5,
          44.4,
          58.6
        ]
      },
      "evidence_strength": "reported_fact",
      "prohibited_overstatement": "仅可表述为合成观察性关联；不得表述为真实患者研究或因果效应。",
      "visual_asset_path": ""
    },
    {
      "slide_id": "SLD-5C85C33891BD51B6B8A0",
      "slide_revision": 1,
      "slide_role": "result",
      "narrative_mode": "scientific_problem",
      "key_message": "研究采用 landmark 框架：在入组后 24 小时定义暴露，并观察其后 72 小时 AKI 进展。",
      "claim_ids": [
        "SHD-002"
      ],
      "source_ids": [
        "SRC-02-protocol-synopsis-syn-00480991443d"
      ],
      "layout_id": "result_statement",
      "backend": "pptxgenjs",
      "template_layout_id": null,
      "visual_assets": [],
      "editable_object_requirements": [],
      "speaker_notes": "Source: extracted line 4. Avoid: 不得补充输入未提供的真实数据库、伦理审批或外部验证信息。",
      "manual_review_required": true,
      "content_hash": "0f54e0fdf472b8a729150132bb528abc7f9f5cd01a2a2f781c40abd93bde950a",
      "render_hash": "",
      "logical_slide_key": "result:SRC-02-protocol-synopsis-syn-00480991443d:extracted line 4:SHD-002",
      "section_id": "results",
      "figure_ids": [],
      "managed_object_ids": [],
      "powerpoint_slide_id": null,
      "slide_title": "Landmark 设计将暴露定义置于结局观察之前",
      "slide_purpose": "Present one source-bound result",
      "single_key_message": "研究采用 landmark 框架：在入组后 24 小时定义暴露，并观察其后 72 小时 AKI 进展。",
      "proposed_layout": "result_statement",
      "visual_type": "evidence_statement",
      "citation_requirement": "required",
      "speaker_note_summary": "Source: extracted line 4. Avoid: 不得补充输入未提供的真实数据库、伦理审批或外部验证信息。",
      "confidence": "high",
      "evidence_strength": "reported_fact",
      "prohibited_overstatement": "不得补充输入未提供的真实数据库、伦理审批或外部验证信息。",
      "visual_asset_path": ""
    },
    {
      "slide_id": "SLD-8018D568EBF75F53BBD9",
      "slide_revision": 1,
      "slide_role": "result",
      "narrative_mode": "scientific_problem",
      "key_message": "队列流程图展示完全合成样本的纳入、排除与最终分析人群。",
      "claim_ids": [
        "SHD-003"
      ],
      "source_ids": [
        "SRC-figure-1-cohort-flow-768a1278488a"
      ],
      "layout_id": "result_with_figure",
      "backend": "pptxgenjs",
      "template_layout_id": null,
      "visual_assets": [],
      "editable_object_requirements": [],
      "speaker_notes": "Source: figures/figure_1_cohort_flow.png. Avoid: 流程图仅用于合成技术验证；不得解释为真实患者招募。",
      "manual_review_required": true,